编号,性质,标题,受理单位,作者,时间,状态,评论/点击
[81594],[咨询],反对交警乱划分停车位,如何申请示威游行,书记信箱,龙小乱政,2019-10-29,已回复,7/1177
[81589],[诉求],噪音扰民,书记信箱,扶贫者,2019-10-29,已回复,0/300
[81583],[诉求],为什么还会有单位一直轮流借调其他单位的人工作,书记信箱,说散就散,2019-10-29,已回复,1/823
[81576],[举报],宵夜店噪声污染太严重,书记信箱,梧州段正淳,2019-10-29,已回复,1/768
[81560],[诉求],北环路有个提刀的危险人物请重视治安问题,书记信箱,小桂,2019-10-28,已回复,0/423
[81557],[建议],道路改造，有棵树挡住了路口，能否解决？,书记信箱,gg753,2019-10-28,已回复,0/503
[81554],[诉求],噪音,书记信箱,陈婉,2019-10-28,已回复,0/298
[81551],[咨询],行政执法车辆执法停在收费车位可以免费吗？,书记信箱,gg753,2019-10-28,已回复,0/563
[81550],[咨询],停车场私改成其他用途,书记信箱,龙园业主,2019-10-28,已回复,1/398
[81546],[举报],废气排放污染噪音扰民,书记信箱,随风666,2019-10-28,已回复,0/297
[81544],[咨询],太平-平福二级路改造工作目前进展如何？,书记信箱,weishako,2019-10-28,已回复,0/782
[81542],[建议],整改提升环境助力宝石节,书记信箱,茉莉花香,2019-10-28,已回复,0/440
[81541],[建议],关于延长梧州大酒店红绿灯绿灯时长的建议,书记信箱,老啄木鸟,2019-10-28,已回复,0/475
[81535],[诉求],非法占用公用通道堆放垃圾无人管《2》,书记信箱,你算个鸟,2019-10-27,已回复,0/230
[81526],[诉求],关于81244编号的答复,书记信箱,深深的爱着你,2019-10-27,已回复,0/184
[81522],[诉求],关于“编号：80853”的答复极其敷衍,书记信箱,生存空间01,2019-10-27,已回复,0/224
[81517],[咨询],业委会未经业主大会同意签订物业服务合同是否有效？,书记信箱,热心业主,2019-10-27,已回复,0/558
[81511],[举报],对藤县林业局《关于微信群反映油茶苗问题的回复》的质疑,书记信箱,黑色天空,2019-10-27,已回复,0/190
[81509],[建议],应当调整藤县区划,书记信箱,罗乌贼王,2019-10-27,已回复,0/1076
[81507],[建议],应当设立人和区，合并万秀长洲区,书记信箱,罗乌贼王,2019-10-27,已回复,0/2395
[81494],[举报],泥头车灯光,书记信箱,likanglt1230,2019-10-26,已回复,0/128
[81490],[咨询],西江桥的市政工程有何信誉,书记信箱,mykfh,2019-10-26,已回复,0/286
[81486],[举报],几个月都不回复是几个意思？,书记信箱,nfy,2019-10-26,已受理,0/212
[81470],[诉求],水岸名都卖抵押房难道就没有一个部门管的吗,书记信箱,feng515,2019-10-26,已回复,0/267
[81467],[举报],关于耀华永安花园开发商不给业主通行问题,书记信箱,肖小玲,2019-10-26,已回复,0/141
[81461],[举报],横石角的两个码头是否合法？,书记信箱,Ending,2019-10-26,已回复,0/160
[81460],[诉求],工厂一路山地理东巷85.86号拆迁户,书记信箱,ll52510,2019-10-26,已回复,0/155
[81457],[建议],关于梧州道路停车收费问题,书记信箱,李李在李李,2019-10-25,已回复,0/507
[81450],[诉求],停车费收费,书记信箱,小莫莫莫,2019-10-25,已回复,0/144
[81444],[诉求],再次恳求修复福兴农贸市场道路,书记信箱,老啄木鸟,2019-10-25,已回复,0/134
[81443],[举报],万秀区绩效工资,书记信箱,一个闲人,2019-10-25,已回复,0/661
[81442],[诉求],关于龙湖开放式私人住宅小区停车问题,书记信箱,摧城拔寨,2019-10-25,已回复,3/183
[81435],[建议],关于梧州发展的一封信,书记信箱,代盐人,2019-10-25,已回复,0/1589
[81425],[诉求],向市委求助解决龙圩镇阳光庭院7#8#栋的安全问题,书记信箱,1500774,2019-10-25,已回复,4/4799
[81424],[举报],一代天城违建没人管,书记信箱,范总,2019-10-24,已回复,1/1012
[81401],[举报],龙圩区山水汇景2号楼一单元301房违法建筑何时拆除！,书记信箱,huoyujian,2019-10-24,已回复,0/537
[81397],[诉求],关于龙圩区大坡镇松柏村（榕村）的太阳能路灯按装问题？,书记信箱,聂海华,2019-10-23,已回复,0/1013
[81394],[诉求],西环路龙山加油站右转进加州旅馆路段,书记信箱,ABC892833,2019-10-23,已回复,0/686
[81391],[诉求],第二届广西中小学生民族团结进步网络竞赛对小学生不对口,书记信箱,李弟,2019-10-23,已回复,0/1399
[81386],[举报],苍梧县新塘冲公租房建设进展为何一拖再拖？,书记信箱,愤怒者,2019-10-23,已回复,0/728
[81384],[诉求],梧州市里湖村入口至里湖公交车站路段污水横流,书记信箱,城市规划,2019-10-23,已回复,0/189
[81382],[举报],请取缔无证幼儿园,书记信箱,梧州小职员,2019-10-23,已回复,1/471
[81381],[举报],两广市场物业不作为，杂物、车辆堵塞道路。,书记信箱,最爱BBQ,2019-10-23,已回复,0/343
[81375],[诉求],问政号80705，,回复中的图片无法显示,书记信箱,等距离,2019-10-23,已回复
[81372],[举报],龙圩交警,书记信箱,43420,2019-10-23,已回复,1/761
[81371],[举报],海骏达花园三期30栋楼顶违章建筑越来越多,书记信箱,广西东大门,2019-10-23,已回复,0/598
[81369],[诉求],梧州市自然资源局饭堂排放油烟问题,书记信箱,寒雨烟,2019-10-23,已回复,9/577
[81363],[诉求],藤县东海花园小区二期逾期交房，且不给明确交房时间,书记信箱,hendy987,2019-10-23,已回复,0/536
[81362],[诉求],为什么报不了医保,书记信箱,临时工007,2019-10-23,已回复,1/542
[81360],[诉求],步行街臭豆腐严重扰民,书记信箱,四城联创,2019-10-23,已回复,0/409
[81359],[诉求],龙圩南宁百货1号门停车规划,书记信箱,看好梧州,2019-10-23,已回复,4/507
[81357],[诉求],没有公开征集富东小区花基问题,书记信箱,富东,2019-10-22,已回复,0/691
[81349],[诉求],岑溪城管执法无任何监管,书记信箱,反腐利剑360,2019-10-22,已受理,1/469
[81345],[举报],河东步行街最近开了几家臭豆腐小吃铺每天恶臭无比,书记信箱,mxy,2019-10-22,已回复,0/216
[81341],[诉求],一块臭豆腐,书记信箱,无聊人生,2019-10-22,已回复,0/217
[81338],[诉求],宝石噪音扰民,书记信箱,lzs1212,2019-10-22,已回复,0/169
[81327],[举报],龙圩区“龙湖春天小区”业主有家归不得之怪事1,书记信箱,老虎123,2019-10-22,已回复,0/304
[81325],[举报],鸡贩下的环境生活特难受,书记信箱,暖心的港湾,2019-10-22,已回复,0/181
[81324],[诉求],步行街不需要臭豆腐,书记信箱,莲子,2019-10-22,已回复,0/188
[81322],[诉求],半山华府小区周边半夜施工噪音严重影响居民休息,书记信箱,粉坨坨,2019-10-22,已回复,0/554
[81320],[诉求],梧州步行街臭豆腐臭气熏天,书记信箱,关@梧州,2019-10-22,已回复,1/620
[81317],[诉求],龙圩区“龙湖春天小区”业主有家归不得之怪事,书记信箱,老虎123,2019-10-22,已回复,5/1299
[81316],[诉求],希望随意改动的公积金政策能够得到市层面的关注,书记信箱,scarlett,2019-10-22,已回复,1/1338
[81312],[建议],城市道路,书记信箱,卡农变奏,2019-10-22,已回复,0/460
[81311],[建议],恳请取缔小区范围的麻将馆！,书记信箱,红尘一影,2019-10-22,已回复,1/670
[81308],[诉求],在城市中心住宅的地方，这样算乱停乱放吗,书记信箱,我为创城发声,2019-10-22,已回复,0/461
[81306],[举报],大东上路步行街多家臭豆腐店污染环境,书记信箱,陈琴微,2019-10-22,已回复,0/778
[81297],[举报],【关于龙圩区祥龙路“假修路”的后遗问题反映】,书记信箱,LHD_1992,2019-10-22,已回复,1/951
[81295],[诉求],被交警拖走的电动车无法取回,书记信箱,suosuo,2019-10-21,已回复,0/827
[81294],[建议],春湖路(新城市场北门)的水果摊档属占道经营吗?,书记信箱,嗨皮,2019-10-21,已回复,0/136
[81293],[咨询],为何在万秀区政务中心办理的老年人优待证久办不下？,书记信箱,年年好运,2019-10-21,已回复,0/348
[81289],[咨询],关于新街步行街拆除工程的安全问题,书记信箱,cherrichy,2019-10-21,已回复,0/346
[81287],[举报],戴芙妮尔美容院开卡护理过敏要求退未使用部分钱遭拒,书记信箱,乔乔妹m,2019-10-21,已回复,0/163
[81275],[诉求],请问龙圩区停车位规划的依据及告诉公民该如何行走,书记信箱,问政有用吗？,2019-10-21,已回复,3/652
[81265],[诉求],没用,书记信箱,hfdg,2019-10-21,已回复,0/836
[81262],[举报],2轮车乱停乱放,书记信箱,abcdef,2019-10-21,已回复,0/924
[81259],[举报],这个建筑严重影响校容,书记信箱,mrs妮,2019-10-21,已回复,0/420
[81249],[诉求],希望梧州“四城联创”彻底整治餐饮油烟污染,书记信箱,业主期盼,2019-10-20,已回复,0/580
[81242],[咨询],蒙山县茶山水库钓鱼被警察拦住,书记信箱,加劲搞,2019-10-20,已回复,2/342
[81241],[诉求],龙圩区的一些问题,书记信箱,561226,2019-10-20,已回复,0/610
[81240],[咨询],关于街头的爱心小屋,书记信箱,561226,2019-10-20,已回复,0/1329
[81233],[建议],车辆乱停放导致道路堵塞,书记信箱,dtcmail,2019-10-20,已回复,1/255
[81218],[建议],建议政府着手建设夏郢镇旺坡村至平浪村跨江大桥,书记信箱,董黎光,2019-10-20,已回复,0/1566
[81198],[诉求],为什么不设定免费停车场？,书记信箱,李李在李李,2019-10-19,已回复,0/348
[81192],[举报],梧州高中东侧道路变停车场,书记信箱,Honcy215,2019-10-19,已回复,0/509
[81182],[举报],违章建筑,书记信箱,gaj1234,2019-10-19,已回复,0/187
[81179],[举报],新兴三路段连夜施工修路，噪音扰民,书记信箱,浅碎,2019-10-19,已回复,0/180
[81161],[咨询],廉租房怎么变成公租房,书记信箱,徐琦,2019-10-18,已回复,0/842
[81152],[举报],关于岑溪市增量绩效发放,书记信箱,吃瓜群众演员,2019-10-18,已受理,3/2408
[81134],[举报],小区有人违法养狼狗且违法加高房子扰民,书记信箱,必须问问,2019-10-17,已回复,0/468
[81133],[诉求],西江四桥围蔽施工带来不便，希望对施工方加强监督,书记信箱,追逐光明,2019-10-17,已回复,0/582
[81127],[举报],岑溪环保局严重不作为,书记信箱,hznfy,2019-10-17,已受理,1/680
[81124],[举报],岑溪二小有偿补课,书记信箱,我要举报,2019-10-17,已回复,0/975
[81120],[举报],好运花园小区的土地，没有经过土地部门批准违规建筑,书记信箱,yzl03801,2019-10-17,已回复,0/348
[81113],[诉求],这样算浪费纳税人的钱吗~~三问旺城广场检测报告,书记信箱,wczy1,2019-10-17,已回复,0/624
[81112],[诉求],朗日拆违何时排上日程表？,书记信箱,大黄蜂2019,2019-10-17,已回复,0/404
[81111],[举报],西江机场征收林地青苗及附着物补偿费为何没有发放？,书记信箱,西江村,2019-10-17,已回复,0/651
[81104],[其它],零距离问政网页经常无法打开,书记信箱,沙洲浪迹,2019-10-17,已回复,3/521
[81093],[举报],新兴三路亨利玫瑰城对出路段十点半还在施工，严重扰民,书记信箱,Rene,2019-10-16,已回复,1/560
[81079],[其它],一块石头大做文章，梧州学院可羞矣,书记信箱,ELSAWONG,2019-10-16,已回复,0/615
[81057],[诉求],南站特色爬山路,书记信箱,1900,2019-10-16,已回复,0/525
[81053],[举报],欣建卖车位合法吗,书记信箱,人生无奈123,2019-10-16,已回复,0/592
[81028],[诉求],梧州的医保账户共济根本上根本是无法实现的,书记信箱,路遥知马力,2019-10-15,已回复,0/647
[81025],[咨询],道路大修市民上下班不方便,书记信箱,半边风景,2019-10-15,已回复,0/306
[81019],[诉求],冰雪小镇连夜开工，占用时代花园城道路，造成损坏,书记信箱,等距离,2019-10-15,已回复,0/1561
[81018],[举报],午托扰民何时休,书记信箱,xu哥,2019-10-15,已回复,4/621
[81016],[举报],79819号问政,书记信箱,秦汉思源,2019-10-15,已回复,0/522
[81015],[举报],人寿岑溪公司不执行桂政办发(2019)80号文件,书记信箱,退休人,2019-10-15,已回复,0/632
[81004],[诉求],与四城联创背道而驰的扰民夜市店铺为何无人管？？？,书记信箱,黄黄1982,2019-10-15,已回复,0/470
[81003],[举报],工地扬尘扰民害民谁负责,书记信箱,晓晓姐,2019-10-15,已回复,0/279
[81000],[举报],工地扬尘扰民害民谁负责,书记信箱,晓晓姐,2019-10-15,已回复,0/630
[80993],[诉求],关于龙圩区大坡镇市场摆摊问题,书记信箱,千千千620,2019-10-15,已回复,0/469
[80991],[诉求],岑溪市鼎盛花园小区后面工地晚上施工噪音大,书记信箱,Gvj,2019-10-15,已受理,0/318
[80989],[举报],富民一路华光巷工程车噪音,书记信箱,心闲,2019-10-15,已回复,0/607
[80988],[诉求],再问：与时代花园城同信物业签了服务协议却没拿到手,书记信箱,归去来,2019-10-15,已回复,0/518
[80966],[举报],奥园名湖城一期开裂问题逾期2个月未答复,书记信箱,苍海桑田123,2019-10-14,已回复,0/834
[80964],[举报],梧州市的路边停车是否真的合法？？？,书记信箱,抱紧可爱,2019-10-14,已回复,1/632
[80962],[诉求],请求政府公平对待良好市民,书记信箱,受气包,2019-10-14,已回复,1/555
[80958],[诉求],彰泰玫瑰园17栋整层未设计产权车位是否能通过审批,书记信箱,初心在哪里,2019-10-14,已回复,0/693
[80953],[诉求],岑溪天然气公司单开户费就要2800元，谈何惠民环保？,书记信箱,一叶一追寻,2019-10-14,已受理,1/544
[80951],[诉求],梧州房源信息网网页打不开,书记信箱,disjoe,2019-10-14,已回复,0/640
[80948],[举报],被大货车包围的困扰,书记信箱,飘雪姐,2019-10-14,已回复,0/261
[80947],[举报],环境污染,书记信箱,gaj1234,2019-10-14,已回复,0/190
[80936],[举报],濛江镇至辖区勒竹村道路何时完成扩宽和路面建设？,书记信箱,xeon1257314,2019-10-13,已回复,15/269
[80932],[举报],举报信,书记信箱,蒲华泽,2019-10-13,已受理,1/531
[80924],[举报],学校补课,书记信箱,923744735,2019-10-13,已回复,0/1068
[80914],[诉求],居民强占通道，城管推自然资源局，自然资源局推社区,书记信箱,cqh13589043,2019-10-13,已回复,0/501
[80893],[举报],恳请管管中铁玫瑰湾四周道路的大货车,书记信箱,玫瑰湾业主,2019-10-12,已回复,0/156
[80892],[举报],东方森源房地产枉顾业主生命财产安全,书记信箱,老王看不下去,2019-10-12,已回复,0/149
[80891],[诉求],罚款易，停车难,书记信箱,werdzxc,2019-10-12,已回复,0/308
[80879],[诉求],为什么10月后上班时间不变,书记信箱,说散就散,2019-10-12,已回复,0/1364
[80877],[诉求],关于藤县麻纺厂职工回迁房辐射严重问题的投诉,书记信箱,都市美态,2019-10-12,已回复,1/638
[80866],[举报],关于“四城联创”龙圩区丽源居小区周边脏乱差的问题,书记信箱,旧苍梧佬,2019-10-12,已回复,1/731
[80859],[诉求],非法占用公用通道堆放建筑垃圾无人管,书记信箱,你算个鸟,2019-10-11,已回复,0/665
[80855],[诉求],红岭一带每晚都是毒气毒气熏天没人管吗？,书记信箱,黄献,2019-10-11,已回复,3/756
[80853],[举报],乱搭乱建严重，阻碍其他业主出行,书记信箱,生存空间01,2019-10-11,已回复,3/2580
[80850],[建议],建议调整社区居委办公时间,书记信箱,小小长洲人,2019-10-11,已回复,0/775
[80845],[举报],破坏环境,书记信箱,甘火焕,2019-10-11,已回复,0/414
[80834],[诉求],请管理一下西堤二路红会医院路段交通乱象,书记信箱,摩行骑者,2019-10-11,已回复,0/777
[80822],[举报],关于旺城首玺施工造成房屋受损的第四次申报,书记信箱,新兴村一组村民,2019-10-11,已回复,1/476
[80820],[诉求],中国移动的信号在市区怎么都这么差,书记信箱,乌小峡,2019-10-11,已受理,0/339
[80815],[举报],举报午托扰民,书记信箱,xu哥,2019-10-11,已回复,0/1598
[80808],[举报],红岭片区裸露地块灰尘大，责任谁负,书记信箱,李小姐v,2019-10-11,已回复,0/397
[80807],[举报],一代天城违建物体何时拆除,书记信箱,7号钟生,2019-10-11,已回复,0/353
[80805],[建议],城市美化,书记信箱,广信西江,2019-10-11,已受理,0/238
[80802],[诉求],关于欣建十幢三单元质量问题处理,书记信箱,林少少,2019-10-11,已回复,0/290
[80801],[诉求],玫瑰湖恒祥豪苑三期小区因打装一百多户房子开裂,书记信箱,远远,2019-10-11,已回复,0/286
[80795],[诉求],请求回复,书记信箱,无花果123,2019-10-10,已回复,0/370
[80789],[举报],宝石噪音扰民,书记信箱,Aaaa林,2019-10-10,已回复,0/268
[80772],[诉求],龙圩区佳和碧海湾无任何合格条件收房,书记信箱,qwertyuiop11,2019-10-10,已回复,0/717
[80768],[诉求],梧州灏景玥城2梯3户变1梯3户,书记信箱,游民,2019-10-10,已回复,0/1173
[80754],[举报],海事局占道,书记信箱,雨过天晴138,2019-10-10,已回复,0/513
[80750],[建议],能否增加途径河西西堤路开往梧州南站的公交车,书记信箱,lupao007,2019-10-10,已回复,0/726
[80749],[举报],藤县碧水湾三期施工扰民,书记信箱,陈日庆,2019-10-10,已回复,0/224
[80744],[举报],粉尘污染，噪音扰民,书记信箱,坚嘢,2019-10-10,已回复,0/473
[80734],[诉求],设卡拦路是否合法？,书记信箱,广新故事,2019-10-09,已回复,0/573
[80705],[诉求],关于时代花园城物业管理严重失职问题,书记信箱,等距离,2019-10-09,已回复,10/1136
[80661],[咨询],龙圩区龙城路的机动车道何时改造？,书记信箱,23xy,2019-10-08,已回复,0/534
[80659],[举报],日化路西江四桥建造妨碍道路通行，消防通道没了,书记信箱,13607744399,2019-10-08,已回复,0/543
[80657],[诉求],要投诉多少次才能处理商铺噪音,书记信箱,噪音扰民1,2019-10-08,已回复,0/445
[80651],[举报],岑溪市农商行不执行桂政办发(2019)80号文件,书记信箱,退休人,2019-10-08,已回复,0/524
[80649],[诉求],梧州邮政局侵占新湖二路北段造成瓶颈路,书记信箱,城市规划,2019-10-08,已回复,1/444
[80636],[举报],工厂二路三和里居民強占公共道路,书记信箱,cqh13589043,2019-10-08,已回复,0/328
[80611],[建议],关于道路周边停车场收费的一些建议,书记信箱,李李在李李,2019-10-08,已回复,1/500
[80609],[举报],乱停乱放车辆严重影响交通,书记信箱,专属夜工,2019-10-08,已回复,0/447
[80600],[诉求],蒙山的新墟镇部分公路为什么不养护？,书记信箱,提醒市民,2019-10-07,已回复,0/219
[80598],[诉求],梧州南站出租车拒载不打表问题,书记信箱,wz122,2019-10-07,已回复,0/437
[80568],[诉求],关于龙骨冲新建路边小车停车位的问题,书记信箱,begin18,2019-10-06,已回复,0/227
[80558],[举报],富民一路华光巷交通问题,书记信箱,心闲,2019-10-06,已回复,0/300
[80554],[诉求],藤县河西防洪堤乱摆乱卖,书记信箱,没有,2019-10-06,已回复,0/144
[80552],[诉求],梧州的餐饮场所何时才能禁烟,书记信箱,h1r2m3,2019-10-06,已回复,1/264
[80538],[咨询],这样符合四城联创工作的要求,书记信箱,abcdef,2019-10-05,已回复,0/292
[80537],[举报],藤县发生重大假苗坑农事件,书记信箱,红叶秋,2019-10-05,已回复,0/454
[80528],[举报],三清三拆,书记信箱,莫镇瑛,2019-10-04,已回复,0/233
[80520],[举报],学生进校门需要接受翻包检查？,书记信箱,熊人,2019-10-04,已回复,0/538
[80504],[建议],关于道路停车收费问题,书记信箱,李李在李李,2019-10-04,已回复,1/342
[80498],[建议],能否将茂名-信宜的城际列车延伸至岑溪开行？,书记信箱,piview,2019-10-03,已回复,0/2086
[80477],[诉求],乡镇道路的路面和交通能关心一下和管理一下吗,书记信箱,何大懂,2019-10-03,已回复,1/230
[80469],[诉求],民主路19号夹层违建阳台,书记信箱,光明123,2019-10-03,已回复,0/183
[80466],[举报],旺城广场负一楼国际太空站游乐场小孩受伤没有部门处理,书记信箱,王凤平,2019-10-03,已回复,0/231
[80449],[诉求],龙圩区到处抄车牌,书记信箱,城市猎人2019,2019-10-02,已受理,2/343
[80440],[举报],破坏生态环境,书记信箱,m562ss,2019-10-02,已回复,0/186
[80431],[举报],金源世家地基打桩引起房屋裂缝,书记信箱,甘镜安,2019-10-02,已回复,0/343
[80415],[举报],旺城广场负一楼国际太空站儿童游乐场存在极大安全隐患,书记信箱,胡仁程,2019-10-02,已回复,0/132
[80412],[诉求],云龙桥南岸路灯建设问题,书记信箱,舒乐安定,2019-10-01,已回复,0/142
[80411],[诉求],12369环保投诉真的合理吗？,书记信箱,来一起摇摆,2019-10-01,已回复,0/178
[80408],[诉求],停车泄私隐,书记信箱,飞天鸡毛,2019-10-01,已回复,1/193
[80407],[咨询],关于桂江温馨家园问题,书记信箱,大人,2019-10-01,已回复,0/160
[80396],[建议],关于石人冲蓬塘山棚改（小游园）项目问题,书记信箱,小梁同学,2019-10-01,已回复,0/492
[80370],[举报],电梯问题,书记信箱,小乖乖,2019-10-01,已回复,0/177
[80367],[咨询],关于龙圩交警强行拖走摩托车的一些疑问,书记信箱,suosuo,2019-10-01,已回复,0/335
[80360],[诉求],龙圩区恒大绿洲销售不公隐瞒真相，欺骗业主,书记信箱,lixian,2019-10-01,已回复,3/8005
[80322],[咨询],业委会被罢免，被法院己立案受理期能否召开业主大会,书记信箱,热心业主,2019-09-30,已回复,0/2348
[80313],[举报],岑溪二中严重补课,书记信箱,梁小猫,2019-09-30,已回复,0/1085
[80305],[建议],玫瑰湖公园篮球场能否升级成灯光球场,书记信箱,篮球小子520,2019-09-30,已回复,0/860
[80303],[举报],佳和碧海湾一期标准强行收楼，物业管理费乱收,书记信箱,Loklaiwaa,2019-09-30,已回复,0/1422
[80298],[咨询],为什么全梧州地区没有一个“四好农村路”示范县？,书记信箱,weishako,2019-09-30,已回复,0/983
[80278],[诉求],继续追问，78414编号问政为何一直石沉大海！,书记信箱,幸运女神,2019-09-30,已回复,0/944
[80236],[举报],岑溪市文华学校补课,书记信箱,高良,2019-09-29,已回复,0/161
[80034],[举报],岑溪三中国庆强行补课,书记信箱,陈彬松,2019-09-29,已回复,0/185
[79959],[诉求],岑溪市诚谏镇陀村社垌至思义组水泥硬化路,书记信箱,岑溪人民58,2019-09-29,已回复,1/286
[79956],[诉求],环境污染居民健康,书记信箱,岑溪小闻,2019-09-29,已回复,0/426
[79948],[举报],梧州步埠路新富里93号楼下单车棚是否属于占道经营,书记信箱,超萌尛姐姐,2019-09-29,已回复,2/967
[79933],[举报],红岭一带晚上毒气熏天,书记信箱,梁向雄,2019-09-29,已回复,0/421
[79922],[诉求],倒水镇垃圾焚烧问题,书记信箱,fengjinming,2019-09-28,已回复,0/179
[79920],[诉求],第二次投诉潮源日日鲜全牛火锅扰民,书记信箱,小虫儿,2019-09-28,已回复,0/394
[79918],[诉求],藤县北京燃气公司违规收取安装费该谁来管？,书记信箱,藤县农民工,2019-09-28,已回复,0/278
[79917],[诉求],交通环境恶劣,书记信箱,4050,2019-09-28,已回复,0/203
[79915],[举报],岑溪市一小乱收费问题,书记信箱,平凡的世界,2019-09-28,已回复,0/396
[79880],[举报],请龙圩区人民政府履行生效判决书,书记信箱,lh474544651,2019-09-28,已回复,0/737
[79878],[诉求],关于富民一路华光巷交通管制问题,书记信箱,万万之光,2019-09-28,已回复,0/206
[79867],[建议],梧州西江路左转问题解决建议,书记信箱,公民555,2019-09-27,已回复,0/208
[79864],[举报],蒙山县人民医院区别对待贫困户患者治疗,书记信箱,不平必鸣。3,2019-09-27,已回复,0/272
[79861],[举报],岑溪市第三中学强制补课,书记信箱,三中的,2019-09-27,已回复,0/222
[79844],[举报],沙头镇为何所有周边居民区都可以成为砂石加工厂？,书记信箱,浪费一只鞋,2019-09-27,已回复,0/471
[79839],[举报],万隆石场爆破面离居民居住点很近，直线不足200米！,书记信箱,五十五龙,2019-09-27,已回复,0/263
[79838],[诉求],岑溪公交车怎么没有学生半票的价钱,书记信箱,小时0908,2019-09-27,已回复,0/178
[79826],[诉求],请龙圩区人民政府尊重法律、尊重判决、履行判决。,书记信箱,lh474544651,2019-09-27,已回复,0/1440
[79818],[举报],关于一代天城午托乱象第四问,书记信箱,rmqz001,2019-09-27,已回复,0/727
[79793],[举报],岑溪一中补课问题严重,书记信箱,一中啊坤,2019-09-27,已回复,0/779
[79785],[诉求],与时代花园城同信物业签了服务协议却没拿到手,书记信箱,归去来,2019-09-27,已回复,0/609
[79784],[举报],小区车库改建后开办小学生午托班是否合法合规？,书记信箱,鱼鱼0802,2019-09-26,已回复,0/456
[79777],[诉求],商铺使用喇叭噪音扰民,书记信箱,噪音扰民1,2019-09-26,已回复,0/381
[79771],[诉求],路小车慢走,书记信箱,KI11000,2019-09-26,已回复,0/250
[79770],[举报],大运三轮摩托在香城B区内维修店噪音扰人,书记信箱,包部平,2019-09-26,已回复,0/260
[79768],[诉求],关于：78497的问政，为什么没有准确回复和解决,书记信箱,yhn890211,2019-09-26,已回复,0/255
[79765],[举报],御景名城浇粪种菜多次举报仍没有解决,书记信箱,福报,2019-09-26,已回复,0/3074
